Bus Hound 5.00 capture. Complements of www.perisoft.net

  Device - Device ID (followed by the endpoint for USB devices)
            (16) USB 人体学输入设备
  Phase  - Phase Type
            CTL   USB control transfer       
            DI    Data in                    
            DO    Data out                   
            LEN   Data length                
  Data   - Hex dump of the data transferred
  Descr  - Description of the phase
  Cmd... - Position in the captured data


Device  Phase  Data                                                                                                    Description       Cmd.Phase.Ofs(rep)
------  -----  ------------------------------------------------------------------------------------------------------  ----------------  ------------------
  16.1  LEN    08 00 00 00                                                                                             8                        1.1.0        
  16.1  DI     00 00 00 00  00 00 00 00                                                                                ........                 1.2.0        
  16.0  CTL    80 06 00 01  00 00 12 00                                                                                GET DESCRIPTOR           2.1.0        
  16.0  LEN    12 00 00 00                                                                                             18                       2.2.0        
  16.0  DI     12 01 10 01  00 00 00 08  3c 41 03 20  00 02 01 02  00 01                                               ........<A. ....         2.3.0        
  16.0  CTL    80 06 00 02  00 00 09 00                                                                                GET DESCRIPTOR           3.1.0        
  16.0  LEN    09 00 00 00                                                                                             9                        3.2.0        
  16.0  DI     09 02 22 00  01 01 04 a0  23                                                                            ..".....#                3.3.0        
  16.0  CTL    80 06 00 02  00 00 22 00                                                                                GET DESCRIPTOR           4.1.0        
  16.0  LEN    22 00 00 00                                                                                             34                       4.2.0        
  16.0  DI     09 02 22 00  01 01 04 a0  23 09 04 00  00 01 03 01  01 05 09 21  10 01 00 01  22 41 00 07  05 81 03 08  ..".....#.......         4.3.0        
               00 18                                                                                                   ..                       4.3.32       
  16.0  CTL    00 09 01 00  00 00 00 00                                                                                SET CONFIG               5.1.0        
  16.0  CTL    21 0a 00 00  00 00 00 00                                                                                SET IDLE                 6.1.0        
  16.0  CTL    81 06 00 22  00 00 81 00                                                                                GET DESCRIPTOR           7.1.0        
  16.0  LEN    41 00 00 00                                                                                             65                       7.2.0        
  16.0  DI     05 01 09 06  a1 01 05 07  19 e0 29 e7  15 00 25 01  75 01 95 08  81 02 95 01  75 08 81 01  95 03 75 01  ..........)...%.         7.3.0        
               05 08 19 01  29 03 91 02  95 01 75 05  91 01 95 06  75 08 15 00  26 ff 00 05  07 19 00 2a  ff 00 81 00  ....).....u.....         7.3.32       
               c0                                                                                                      .                        7.3.64       
  16.0  CTL    21 09 00 02  00 00 01 00                                                                                SET REPORT               8.1.0        
  16.0  LEN    01 00 00 00                                                                                             1                        8.2.0        
  16.0  DO     01                                                                                                      .                        8.3.0        
  16.1  LEN    08 00 00 00                                                                                             8                        9.1.0        
  16.1  DI     00 00 0b 00  00 00 00 00                                                                                ........                 9.2.0        
  16.1  LEN    08 00 00 00                                                                                             8                       10.1.0        
  16.1  DI     00 00 00 00  00 00 00 00                                                                                ........                10.2.0        
  16.1  LEN    08 00 00 00                                                                                             8                       11.1.0        
  16.1  DI     00 00 0c 00  00 00 00 00                                                                                ........                11.2.0        
  16.1  LEN    08 00 00 00                                                                                             8                       12.1.0        
  16.1  DI     00 00 00 00  00 00 00 00                                                                                ........                12.2.0        
  16.1  LEN    08 00 00 00                                                                                             8                       13.1.0        
  16.1  DI     00 00 07 00  00 00 00 00                                                                                ........                13.2.0        
  16.1  LEN    08 00 00 00                                                                                             8                       14.1.0        
  16.1  DI     00 00 00 00  00 00 00 00                                                                                ........                14.2.0        
